{
  "$schema": "https://json-schema.org/draft/2020-12/schema",
  "$id": "https://bitshala.org/schemas/cohort-config.schema.json",
  "title": "Cohort Config",
  "description": "Configuration for a single cohort, loaded and validated at startup by CohortsConfigService. The file name must match the CohortType (lower-cased, underscores -> hyphens). Global links shared by every cohort (Wheel of Names, MultiBuzz) are added in code and need not be listed here.",
  "type": "object",
  "additionalProperties": false,
  "required": [
    "gdSessions",
    "weeks",
    "links"
  ],
  "properties": {
    "$schema": {
      "type": "string",
      "description": "Editor tooling only. Points at this schema for autocomplete + inline docs; stripped before validation."
    },
    "gdSessions": {
      "type": "integer",
      "minimum": 1,
      "maximum": 8,
      "description": "Number of group-discussion sessions. Must equal the length of `weeks`."
    },
    "classroomId": {
      "type": "string",
      "pattern": "^[0-9]+$",
      "description": "GitHub Classroom id used to sync exercise scores. Required when any week has `hasExercise: true`; may be omitted otherwise. Only used when assignmentBackend is CLASSROOM."
    },
    "links": {
      "type": "array",
      "description": "Course-specific links for this cohort. Use [] when there are none. Global links shared by every cohort are merged in by CohortsConfigService at load time, so do not list them here.",
      "items": {
        "$ref": "#/$defs/link"
      }
    },
    "weeks": {
      "type": "array",
      "minItems": 1,
      "maxItems": 8,
      "description": "One entry per group-discussion session. Length must equal `gdSessions`.",
      "items": {
        "$ref": "#/$defs/week"
      }
    },
    "assignmentBackend": {
      "type": "string",
      "enum": [
        "CLASSROOM",
        "INHOUSE"
      ],
      "description": "Which system grades this cohort's exercises. Defaults to CLASSROOM. INHOUSE requires an `assignment` block on every exercise week and ignores classroomId."
    }
  },
  "allOf": [
    {
      "if": {
        "type": "object",
        "properties": {
          "weeks": {
            "type": "array",
            "contains": {
              "type": "object",
              "properties": {
                "hasExercise": {
                  "const": true
                }
              },
              "required": [
                "hasExercise"
              ]
            }
          },
          "assignmentBackend": {
            "not": {
              "const": "INHOUSE"
            }
          }
        },
        "required": [
          "weeks"
        ]
      },
      "then": {
        "required": [
          "classroomId"
        ]
      }
    },
    {
      "if": {
        "type": "object",
        "properties": {
          "assignmentBackend": {
            "const": "INHOUSE"
          }
        },
        "required": [
          "assignmentBackend"
        ]
      },
      "then": {
        "properties": {
          "weeks": {
            "type": "array",
            "items": {
              "allOf": [
                {
                  "if": {
                    "type": "object",
                    "properties": {
                      "hasExercise": {
                        "const": true
                      }
                    },
                    "required": [
                      "hasExercise"
                    ]
                  },
                  "then": {
                    "type": "object",
                    "required": [
                      "assignment"
                    ]
                  }
                }
              ]
            }
          }
        }
      }
    }
  ],
  "$defs": {
    "week": {
      "type": "object",
      "additionalProperties": false,
      "required": [
        "hasExercise",
        "questions",
        "bonusQuestions",
        "title",
        "readingMaterial"
      ],
      "properties": {
        "hasExercise": {
          "type": "boolean",
          "description": "Whether this week has a graded exercise (scored via GitHub Classroom). When true, `exercise` content is required and the cohort must declare `classroomId`."
        },
        "questions": {
          "type": "array",
          "description": "Discussion questions for the week.",
          "items": {
            "$ref": "#/$defs/question"
          }
        },
        "bonusQuestions": {
          "type": "array",
          "description": "Optional-to-answer bonus discussion questions.",
          "items": {
            "$ref": "#/$defs/question"
          }
        },
        "title": {
          "type": "string",
          "description": "Week title."
        },
        "readingMaterial": {
          "type": "array",
          "description": "Reading-material links for the week.",
          "items": {
            "$ref": "#/$defs/readingMaterial"
          }
        },
        "activity": {
          "type": "string",
          "description": "Optional free-text activity for the week. Omit when there is none."
        },
        "exercise": {
          "$ref": "#/$defs/exercise",
          "description": "Exercise content. Required when `hasExercise` is true; omit otherwise."
        },
        "assignment": {
          "$ref": "#/$defs/assignment"
        }
      },
      "allOf": [
        {
          "if": {
            "type": "object",
            "properties": {
              "hasExercise": {
                "const": true
              }
            },
            "required": [
              "hasExercise"
            ]
          },
          "then": {
            "required": [
              "exercise"
            ]
          }
        }
      ]
    },
    "question": {
      "type": "object",
      "additionalProperties": false,
      "required": [
        "text"
      ],
      "properties": {
        "text": {
          "type": "string",
          "description": "Question prompt."
        },
        "attachments": {
          "type": "array",
          "description": "Optional file names, relative to the cohort's attachments directory (assets/cohort-configs/attachments/<cohort>/). Each file must exist on disk. Omit when the question has no attachments.",
          "items": {
            "type": "string"
          }
        }
      }
    },
    "readingMaterial": {
      "type": "object",
      "additionalProperties": false,
      "required": [
        "label",
        "url"
      ],
      "properties": {
        "label": {
          "type": "string",
          "description": "Display label."
        },
        "url": {
          "type": "string",
          "description": "Link URL."
        }
      }
    },
    "exercise": {
      "type": "object",
      "additionalProperties": false,
      "required": [
        "title",
        "concepts",
        "problem",
        "expectedOutput"
      ],
      "properties": {
        "title": {
          "type": "string",
          "description": "Exercise title."
        },
        "concepts": {
          "type": "string",
          "description": "Concepts the exercise covers."
        },
        "problem": {
          "type": "string",
          "description": "Problem statement."
        },
        "expectedOutput": {
          "type": "array",
          "description": "Expected output lines.",
          "items": {
            "type": "string"
          }
        }
      }
    },
    "link": {
      "type": "object",
      "additionalProperties": false,
      "required": [
        "label",
        "url"
      ],
      "properties": {
        "label": {
          "type": "string",
          "description": "Display label."
        },
        "url": {
          "type": "string",
          "description": "Link URL."
        },
        "minRole": {
          "type": "string",
          "enum": [
            "ADMIN",
            "TEACHING_ASSISTANT",
            "STUDENT"
          ],
          "description": "Minimum role required to see this link. Absent => visible to everyone."
        }
      }
    },
    "assignment": {
      "type": "object",
      "additionalProperties": false,
      "description": "Grading mechanics for an in-house exercise week. The problem statement stays in `exercise`.",
      "required": [
        "slug",
        "templateOwner",
        "templateRepo",
        "graderTestPath"
      ],
      "properties": {
        "slug": {
          "type": "string",
          "pattern": "^[a-z0-9]+(-[a-z0-9]+)*$",
          "description": "Becomes part of the repo name. The cohort season is appended automatically."
        },
        "templateOwner": {
          "type": "string"
        },
        "templateRepo": {
          "type": "string"
        },
        "templateRef": {
          "type": "string",
          "description": "Branch or tag of the template; omit for its default branch."
        },
        "graderTestPath": {
          "type": "string",
          "description": "Path to the test suite inside the grader repo, e.g. tests/pb-week-3."
        },
        "graderWorkflowPath": {
          "type": "string",
          "description": "Defaults to .github/workflows/grade.yml."
        },
        "protectedPaths": {
          "type": "array",
          "items": {
            "type": "string"
          },
          "description": "Paths the editor refuses to write. Exact paths and prefix/** patterns only. Defaults to [\".github/**\"]."
        },
        "deadline": {
          "enum": [
            "GRADUATION"
          ],
          "description": "Anchors the deadline to the cohort's graduation day, and keeps it there \u2014 moving the cohort's dates moves the deadline with them, because it is recomputed from the graduation week rather than frozen at seed time. This is what the courses run: every exercise is due when the cohort ends. Mutually exclusive with `deadlineDaysAfterWeek`; omit both for no deadline, in which case every run counts for score."
        },
        "deadlineDaysAfterWeek": {
          "type": "integer",
          "minimum": 0,
          "description": "A fixed offset from this assignment's own week, for an exercise due before the cohort ends. Unlike `deadline`, this is relative to the week, so it moves when that week moves but is unaffected by graduation. Mutually exclusive with `deadline`; omit both for no deadline."
        },
        "allowLateSubmission": {
          "type": "boolean",
          "description": "Whether editing and running stay permitted after the deadline. They never affect the score once it passes. Defaults to true."
        },
        "maxRunsPerDay": {
          "type": "integer",
          "minimum": 1
        },
        "runTimeoutMinutes": {
          "type": "integer",
          "minimum": 1,
          "maximum": 60
        }
      }
    }
  }
}
