{
  "$schema": "./cohort-config.schema.json",
  "assignmentBackend": "INHOUSE",
  "gdSessions": 7,
  "classroomId": "243620",
  "links": [],
  "weeks": [
    {
      "hasExercise": true,
      "assignment": {
        "slug": "pb-week-1",
        "templateOwner": "Bitshala-Classrooms",
        "templateRepo": "PB-week-1-assignment",
        "graderTestPath": "tests/pb-week-1",
        "deadline": "GRADUATION",
        "runTimeoutMinutes": 20
      },
      "exercise": {
        "title": "Finite Fields and Elliptic Curves",
        "concepts": "Finite field arithmetic, modular arithmetic, Fermat's little theorem, elliptic curve point addition",
        "problem": "Implement the mathematical building blocks of Bitcoin's cryptography in Python. Build a FieldElement class supporting addition, subtraction, multiplication, exponentiation, and division over a finite field using modular arithmetic (using Fermat's little theorem for division). Then build a Point class representing points on an elliptic curve y² = x³ + ax + b, implementing point addition for all cases: the point at infinity (identity), additive inverses, points with different x coordinates, and point doubling. Complete all exercises in Chapter1.ipynb and Chapter2.ipynb.",
        "expectedOutput": [
          "A working FieldElement class with all arithmetic operations defined over a prime field",
          "A Point class that correctly validates curve membership and handles all point addition cases including identity and doubling",
          "All cells in Chapter1.ipynb and Chapter2.ipynb running without errors"
        ]
      },
      "title": "Finite Fields & Elliptic Curves",
      "readingMaterial": [
        { "label": "Chapter 1: Finite Fields", "url": "https://github.com/jimmysong/programmingbitcoin/blob/master/ch01.asciidoc" },
        { "label": "Chapter 2: Elliptic Curves", "url": "https://github.com/jimmysong/programmingbitcoin/blob/master/ch02.asciidoc" }
      ],
      "questions": [
        { "text": "What is a modulo operation? What are the mathematical properties of finite fields? Why are these properties important to have?" },
        { "text": "Can you explain in simple terms what does order of a finite field means? Why finite fields are constructed with a prime modulo? What happens if its not a prime?" },
        { "text": "Explain Fermat's little theorem. What is it used for?" },
        { "text": "How to express negative numbers in finite field? What would be the positive number equivalent of -27mod(5)?" },
        { "text": "What is an elliptic curve? What was the earliest known elliptic curve? Why elliptic curves are useful in cryptography?" },
        { "text": "Explain elliptic curve point addition in simple terms." },
        { "text": "For elliptic curve point addition the last step is to reflect the resulting point across x-axis. Why is this needed? What happens if there was no reflection?" },
        { "text": "What is the Point at Infinity? What curve operation produces the point at Infinity? Is it useful in real life crypto implementation?" }
      ],
      "bonusQuestions": [
        { "text": "What is (0,0) + (0,0) ?" },
        { "text": "What are groups? How do they differ from fields." },
        { "text": "What advantage does ECDSA provide in terms of transmission time over network." },
        { "text": "How do we negate a number in a mod n finite field?" }
      ]
    },
    {
      "hasExercise": true,
      "assignment": {
        "slug": "pb-week-2",
        "templateOwner": "Bitshala-Classrooms",
        "templateRepo": "PB-week-2-assignment",
        "graderTestPath": "tests/pb-week-2",
        "deadline": "GRADUATION",
        "runTimeoutMinutes": 20
      },
      "exercise": {
        "title": "Elliptic Curve Cryptography",
        "concepts": "Elliptic curves over finite fields, scalar multiplication, secp256k1, public/private key pairs, ECDSA signing and verification",
        "problem": "Combine finite fields and elliptic curves to build working elliptic curve cryptography. Implement curve points over a finite field and scalar multiplication using binary expansion. Define the secp256k1 curve parameters used by Bitcoin (S256Field, S256Point, the generator point G, and the group order N). Then implement Signature and PrivateKey classes to perform ECDSA: derive a public key from a private key, sign a message hash, and verify a signature. Complete all exercises in Chapter3.ipynb.",
        "expectedOutput": [
          "Elliptic curve point operations working over a finite field, including efficient scalar multiplication",
          "A working secp256k1 implementation with the correct generator point and group order",
          "ECDSA signature creation and verification that round-trips correctly",
          "All cells in Chapter3.ipynb running without errors"
        ]
      },
      "title": "Elliptic Curve Cryptography",
      "readingMaterial": [
        { "label": "Chapter 3: Elliptic Curve Cryptography", "url": "https://github.com/jimmysong/programmingbitcoin/blob/master/ch03.asciidoc" }
      ],
      "questions": [
        { "text": "What are elliptic curves over finite fields, and how do they differ from normal elliptic curves? Are there any changes in properties between an Elliptic Curve over Finite Fields and Real Numbers?" },
        { "text": "What is the Discrete Log Problem, and why is it important in Cryptography? What does it mean when we say \"DLP is hard\"? What would have happened if DLP wasn't a \"hard\" problem?" },
        { "text": "What is a Mathematical Group, and what properties must a group maintain? What happens if the group operation isn't commutative?" },
        { "text": "What is secp256k1, and are there other curves similar to it? What makes 256k1 special, and over what finite field is it defined?" },
        { "text": "What is the generator point, and how is it determined for a specific curve? Is it chosen randomly? Why did Satoshi choose secp256k1 for Bitcoin?" },
        { "text": "What are Private Keys and Public Keys in the context of elliptic curves? Can you briefly explain the process of generating Private and Public Keys?" },
        { "text": "What are Public Key additions, and what is the result of adding two public keys? Where can the addition of keys be useful?" },
        { "text": "What is a Digital Signature, and what is its purpose? What does a Digital Signature ultimately prove? How many different types of Digital Signature algorithms are known, with ECDSA being one of them?" },
        { "text": "Can you provide a brief description of the Signature Creation and Verification algorithms? Which one takes more time? Bonus: Can you give a real example of the average time taken on your machine for a single ECDSA creation and verification?" },
        { "text": "Why is it important to have a \"unique K\"? What vulnerabilities can be exploited if K is known to be reused? Can you provide a real-life example of when such an exploit occurred?" }
      ],
      "bonusQuestions": [
        { "text": "Let P1 be a point on the secp256k1 curve with order N over prime P. State Fermat’s Little Theorem, treating P1 as the element in the theorem." },
        { "text": "Why do we use finite fields instead of real numbers for cryptography?" }
      ]
    },
    {
      "hasExercise": true,
      "assignment": {
        "slug": "pb-week-3",
        "templateOwner": "Bitshala-Classrooms",
        "templateRepo": "PB-week-3-assignment",
        "graderTestPath": "tests/pb-week-3",
        "deadline": "GRADUATION",
        "runTimeoutMinutes": 20
      },
      "exercise": {
        "title": "Serialization and Transactions",
        "concepts": "SEC public key format, DER signatures, Base58Check, WIF, varints, transaction parsing and serialization, fee calculation",
        "problem": "Implement Bitcoin's serialization formats and transaction structure. Serialize public keys in compressed and uncompressed SEC format, encode signatures in DER format, and implement Base58Check encoding to produce Bitcoin addresses and WIF-encoded private keys. Then build a transaction parser and serializer that handles the version, inputs (previous txid, index, scriptSig, sequence), outputs (amount, scriptPubKey), locktime, and varints, and calculate the fee of a transaction by looking up the value of its inputs. Complete all exercises in Chapter4.ipynb and Chapter5.ipynb.",
        "expectedOutput": [
          "SEC and DER serialization for public keys and signatures",
          "Correct Bitcoin addresses (Base58Check) and WIF private keys derived from key material",
          "A transaction parser that can parse and re-serialize raw transactions losslessly",
          "Correct fee calculation for a parsed transaction, and all cells in Chapter4.ipynb and Chapter5.ipynb running without errors"
        ]
      },
      "title": "Serialization & Transactions",
      "readingMaterial": [
        { "label": "Chapter 4: Serialization", "url": "https://github.com/jimmysong/programmingbitcoin/blob/master/ch04.asciidoc" },
        { "label": "Chapter 5: Transactions", "url": "https://github.com/jimmysong/programmingbitcoin/blob/master/ch05.asciidoc" }
      ],
      "questions": [
        { "text": "What is the Wallet Import Format (WIF) used for, and how is it generated from a private key?" },
        { "text": "How is the compressed SEC format serialised for a point P = (x,y)?" },
        { "text": "Briefly outline the process of creating a Bitcoin address. Which hash operation is used, and what is the purpose of the checksum?" },
        { "text": "How does Base58 encoding addresses some of the potential issues or limitations of Base64 encoding?" },
        { "text": "Explain DER signature encoding with an example." },
        { "text": "Why does a transaction require a version, and what does it signify with respect to upgradability?" },